18:11:15.741401 IP 10.0.1.93.56031 > 10.0.1.1.domain: 7336+ A? e6858.dsce9.akamaiedge.net. (44)
18:11:15.741991 IP 10.0.1.93.57874 > 10.0.1.1.domain: 36652+ AAAA? e6858.dsce9.akamaiedge.net. (44)
18:11:15.898194 IP 10.0.1.1.domain > 10.0.1.93.56031: 7336 1/0/0 A 23.57.146.139 (60)
18:11:15.962242 IP 10.0.1.93.56702 > rio01s15-in-f2.1e100.net.https: Flags [.], ack 2033403271, win 4096, length 0
18:11:16.032594 IP 10.0.1.1.domain > 10.0.1.93.57874: 36652 2/0/0 AAAA 2600:1419:8:198::1aca, AAAA 2600:1419:8:18c::1aca (100)
18:11:16.210100 IP rio01s15-in-f2.1e100.net.https > 10.0.1.93.56702: Flags [.], ack 1, win 350, options [nop,nop,TS val 679817721 ecr 451374152], length 0
18:11:16.346454 IP 10.0.1.93.56716 > a104-89-12-157.deploy.static.akamaitechnologies.com.https: Flags [.], ack 2696913221, win 4096, length 0
18:11:16.419630 IP a104-89-12-157.deploy.static.akamaitechnologies.com.https > 10.0.1.93.56716: Flags [.], ack 1, win 972, options [nop,nop,TS val 1373846119 ecr 451374848], length 0
18:11:16.681401 IP 10.0.1.93.61114 > 10.0.1.1.domain: 18606+ PTR? 1.1.0.10.in-addr.arpa. (39)
18:11:16.743275 IP 10.0.1.1.domain > 10.0.1.93.61114: 18606 NXDomain* 0/0/0 (39)
18:11:17.254328 IP6 sala.local > ff02::1: ICMP6, neighbor advertisement, tgt is sala.local, length 32
18:11:17.746530 IP 10.0.1.93.60044 > 10.0.1.1.domain: 2000+ PTR? 1.0.0.0.0.0.0.0.0.0.0.0.0.0.0.0.0.0.0.0.0.0.0.0.0.0.0.0.2.0.f.f.ip6.arpa. (90)
18:11:17.749331 IP 10.0.1.1.domain > 10.0.1.93.60044: 2000 NXDomain* 0/0/0 (90)
18:11:18.085149 IP 10.0.1.93.54116 > 10.0.1.1.domain: 4644+ PTR? b._dns-sd._udp.0.1.0.10.in-addr.arpa. (54)
18:11:18.086079 IP 10.0.1.93.57322 > 10.0.1.1.domain: 40270+ PTR? db._dns-sd._udp.0.1.0.10.in-addr.arpa. (55)
18:11:18.086079 IP 10.0.1.93.53576 > 10.0.1.1.domain: 59098+ PTR? lb._dns-sd._udp.0.1.0.10.in-addr.arpa. (55)
18:11:18.090946 IP 10.0.1.1.domain > 10.0.1.93.54116: 4644 NXDomain* 0/0/0 (54)
18:11:18.093510 IP 10.0.1.1.domain > 10.0.1.93.57322: 40270 NXDomain* 0/0/0 (55)
18:11:18.094225 IP 10.0.1.1.domain > 10.0.1.93.53576: 59098 NXDomain* 0/0/0 (55)
18:11:18.177612 IP 10.0.1.1.mdns > 224.0.0.251.mdns: 0*- [0q] 18/0/6 (Cache flush) PTR AirPort-Extreme.local., (Cache flush) TXT "", PTR _sleep-proxy._udp.local., PTR 30-35-10-70.1 AirPort Extreme._sleep-proxy._udp.local., SRV airport-extreme.local.:13568 0 0, (Cache flush) PTR AirPort-Extreme.local., (Cache flush) TXT "cu=4dde65b7-ee90-555f-a5a9-f20ee14e9322" "nm=AirPort Extreme" "mac=B8:C7:5D:CD:FC:07" "ssid=hwf.io" "bssinfo=AQIGUYYAAAAGKM/asvcLlX6WCAAAByjP2rL3DA", PTR _acp-sync._tcp.local., PTR VjUFSr1HXFe6xSdkEhH+rA@7OJwS232XUKrbbzgdlqz3A._acp-sync._tcp.local., (Cache flush) TXT "waMA=B8-C7-5D-CD-FC-07,raMA=28-CF-DA-B2-F7-0B,raM2=28-CF-DA-B2-F7-0C,raNm=hwf.io,raCh=6,rCh2=149,raSt=0,raNA=1,syFl=0x820C,syAP=117,syVs=7.6.8,srcv=76800.1,bjSd=29", PTR _airport._tcp.local., PTR AirPort Extreme._airport._tcp.local., TXT "model=AirPort5,117", (Cache flush) SRV AirPort-Extreme.local.:60787 0 0, (Cache flush) A 10.0.1.1, (Cache flush) AAAA fe80::bac7:5dff:fecd:fc07, (Cache flush) SRV AirPort-Extreme.local.:5009 0 0, (Cache flush) SRV AirPort-Extreme.local.:5009 0 0 (1054)
18:11:18.177618 IP6 sala.local > ff02::1: ICMP6, neighbor advertisement, tgt is sala.local, length 32
18:11:18.179368 IP6 airport-extreme.local.mdns > ff02::fb.mdns: 0*- [0q] 18/0/6 (Cache flush) PTR AirPort-Extreme.local., (Cache flush) TXT "", PTR _sleep-proxy._udp.local., PTR 30-35-10-70.1 AirPort Extreme._sleep-proxy._udp.local., SRV airport-extreme.local.:13568 0 0, (Cache flush) PTR AirPort-Extreme.local., (Cache flush) TXT "cu=4dde65b7-ee90-555f-a5a9-f20ee14e9322" "nm=AirPort Extreme" "mac=B8:C7:5D:CD:FC:07" "ssid=hwf.io" "bssinfo=AQIGUYYAAAAGKM/asvcLlX6WCAAAByjP2rL3DA", PTR _acp-sync._tcp.local., PTR VjUFSr1HXFe6xSdkEhH+rA@7OJwS232XUKrbbzgdlqz3A._acp-sync._tcp.local., (Cache flush) TXT "waMA=B8-C7-5D-CD-FC-07,raMA=28-CF-DA-B2-F7-0B,raM2=28-CF-DA-B2-F7-0C,raNm=hwf.io,raCh=6,rCh2=149,raSt=0,raNA=1,syFl=0x820C,syAP=117,syVs=7.6.8,srcv=76800.1,bjSd=29", PTR _airport._tcp.local., PTR AirPort Extreme._airport._tcp.local., TXT "model=AirPort5,117", (Cache flush) SRV AirPort-Extreme.local.:60787 0 0, (Cache flush) A 10.0.1.1, (Cache flush) AAAA fe80::bac7:5dff:fecd:fc07, (Cache flush) SRV AirPort-Extreme.local.:5009 0 0, (Cache flush) SRV AirPort-Extreme.local.:5009 0 0 (1054)
18:11:18.568834 IP 10.0.1.93.56730 > ec2-54-207-34-156.sa-east-1.compute.amazonaws.com.http: Flags [.], ack 4270897455, win 65535, length 0
18:11:18.638118 IP ec2-54-207-34-156.sa-east-1.compute.amazonaws.com.http > 10.0.1.93.56730: Flags [.], ack 1, win 4862, options [nop,nop,TS val 1998394202 ecr 451376765], length 0
18:11:18.751119 IP 10.0.1.93.50170 > 10.0.1.1.domain: 59250+ PTR? 251.0.0.224.in-addr.arpa. (42)
18:11:18.753138 IP 10.0.1.1.domain > 10.0.1.93.50170: 59250 NXDomain* 0/0/0 (42)
18:11:18.754564 IP 10.0.1.93.57225 > 10.0.1.1.domain: 12315+ PTR? b.f.0.0.0.0.0.0.0.0.0.0.0.0.0.0.0.0.0.0.0.0.0.0.0.0.0.0.2.0.f.f.ip6.arpa. (90)
18:11:18.756472 IP 10.0.1.1.domain > 10.0.1.93.57225: 12315 NXDomain* 0/0/0 (90)
18:11:18.757608 IP 10.0.1.93.58159 > 10.0.1.1.domain: 30003+ PTR? 156.34.207.54.in-addr.arpa. (44)
18:11:18.790583 IP 10.0.1.123.mdns > 224.0.0.251.mdns: 0 [3q] PTR (QM)? _233637DE._sub._googlecast._tcp.local. PTR (QM)? _CA5E8412._sub._googlecast._tcp.local. PTR (QM)? _googlecast._tcp.local. (77)
18:11:18.790720 IP 10.0.1.123.42552 > 239.255.255.250.ssdp: UDP, length 125
18:11:18.872589 IP 10.0.1.1.domain > 10.0.1.93.58159: 30003 1/0/0 PTR ec2-54-207-34-156.sa-east-1.compute.amazonaws.com. (107)
18:11:19.097773 IP 10.0.1.123.42552 > 239.255.255.250.ssdp: UDP, length 125
18:11:19.098199 IP 10.0.1.123.42552 > 239.255.255.250.ssdp: UDP, length 122
18:11:19.098204 IP6 sala.local > ff02::1: ICMP6, neighbor advertisement, tgt is sala.local, length 32
18:11:19.405262 IP 10.0.1.123.42552 > 239.255.255.250.ssdp: UDP, length 122
18:11:19.713641 IP 177.43.170.94.static.host.gvt.net.br.https > 10.0.1.93.56683: Flags [P.], seq 3536535239:3536535302, ack 1800985432, win 243, options [nop,nop,TS val 2041526216 ecr 451369594], length 63
18:11:19.713722 IP 10.0.1.93.56683 > 177.43.170.94.static.host.gvt.net.br.https: Flags [.], ack 63, win 4109, options [nop,nop,TS val 451603414 ecr 2041526216], length 0
18:11:19.713889 IP 10.0.1.93.56683 > 177.43.170.94.static.host.gvt.net.br.https: Flags [F.], seq 1, ack 63, win 4109, options [nop,nop,TS val 451603414 ecr 2041526216], length 0
18:11:19.714623 IP 177.43.170.94.static.host.gvt.net.br.https > 10.0.1.93.56683: Flags [F.], seq 63, ack 1, win 243, options [nop,nop,TS val 2041526216 ecr 451369594], length 0
18:11:19.714628 IP 177.43.170.94.static.host.gvt.net.br.https > 10.0.1.93.56683: Flags [F.], seq 63, ack 1, win 243, options [nop,nop,TS val 2041526346 ecr 451369594], length 0
18:11:19.714786 IP 10.0.1.93.56683 > 177.43.170.94.static.host.gvt.net.br.https: Flags [F.], seq 1, ack 64, win 4109, options [nop,nop,TS val 451603414 ecr 2041526216], length 0
18:11:19.714786 IP 10.0.1.93.56683 > 177.43.170.94.static.host.gvt.net.br.https: Flags [F.], seq 1, ack 64, win 4109, options [nop,nop,TS val 451603415 ecr 2041526216], length 0
18:11:19.723417 IP 177.43.170.94.static.host.gvt.net.br.https > 10.0.1.93.56683: Flags [.], ack 2, win 243, options [nop,nop,TS val 2041526386 ecr 451603414], length 0
18:11:19.725047 IP 177.43.170.94.static.host.gvt.net.br.https > 10.0.1.93.56683: Flags [.], ack 2, win 243, options [nop,nop,TS val 2041526387 ecr 451603414], length 0
18:11:19.874844 IP 10.0.1.93.51034 > 10.0.1.1.domain: 56580+ PTR? 123.1.0.10.in-addr.arpa. (41)
18:11:19.878691 IP 10.0.1.1.domain > 10.0.1.93.51034: 56580 NXDomain* 0/0/0 (41)
18:11:19.893772 IP rio01s21-in-f66.1e100.net.http > 10.0.1.93.56680: Flags [F.], seq 1164224107, ack 2019967060, win 341, options [nop,nop,TS val 1293281331 ecr 451369792], length 0
18:11:19.893848 IP 10.0.1.93.56680 > rio01s21-in-f66.1e100.net.http: Flags [.], ack 1, win 4117, options [nop,nop,TS val 451603591 ecr 1293281331], length 0
18:11:20.019263 IP 10.0.1.123.mdns > 224.0.0.251.mdns: 0 [3q] PTR (QM)? _233637DE._sub._googlecast._tcp.local. PTR (QM)? _CA5E8412._sub._googlecast._tcp.local. PTR (QM)? _googlecast._tcp.local. (77)
18:11:20.019361 IP6 fe80::1477:7b4a:5f92:171a > ff02::16: HBH ICMP6, multicast listener report v2, 1 group record(s), length 28
18:11:20.019792 IP 10.0.1.20 > igmp.mcast.net: igmp v3 report, 1 group record(s)
18:11:20.222977 IP 10.0.1.93.56738 > rio01s23-in-f2.1e100.net.https: Flags [.], ack 1958124292, win 4096, length 0
18:11:20.281188 IP rio01s23-in-f2.1e100.net.https > 10.0.1.93.56738: Flags [.], ack 1, win 350, options [nop,nop,TS val 3859771497 ecr 451377874], length 0
18:11:20.326651 IP6 sala.local > ff02::1: ICMP6, neighbor advertisement, tgt is sala.local, length 32
18:11:20.326656 IP 10.0.1.20.mdns > 224.0.0.251.mdns: 0 [1au] PTR (QU)? _sleep-proxy._udp.local. (70)
18:11:20.327057 IP6 fe80::1477:7b4a:5f92:171a.mdns > ff02::fb.mdns: 0 [1au] PTR (QU)? _sleep-proxy._udp.local. (70)
18:11:20.327828 IP 10.0.1.1.mdns > 224.0.0.251.mdns: 0 [8q] [5n] PTR (QU)? _acp-sync._tcp.local. TXT (QU)? VjUFSr1HXFe6xSdkEhH+rA@L8zROQjQU9S1BIIzuZE7lw._acp-sync._tcp.local. TXT (QU)? VjUFSr1HXFe6xSdkEhH+rA@7OJwS232XUKrbbzgdlqz3A._acp-sync._tcp.local. ANY (QU)? 30-35-10-70.1 AirPort Extreme._sleep-proxy._udp.local. ANY (QU)? AirPort-Extreme.local. ANY (QU)? AirPort-Extreme.local. ANY (QU)? VjUFSr1HXFe6xSdkEhH+rA@7OJwS232XUKrbbzgdlqz3A._acp-sync._tcp.local. ANY (QU)? AirPort Extreme._airport._tcp.local. (365)
18:11:20.328405 IP6 airport-extreme.local.mdns > ff02::fb.mdns: 0 [8q] [5n] PTR (QU)? _acp-sync._tcp.local. TXT (QU)? VjUFSr1HXFe6xSdkEhH+rA@L8zROQjQU9S1BIIzuZE7lw._acp-sync._tcp.local. TXT (QU)? VjUFSr1HXFe6xSdkEhH+rA@7OJwS232XUKrbbzgdlqz3A._acp-sync._tcp.local. ANY (QU)? 30-35-10-70.1 AirPort Extreme._sleep-proxy._udp.local. ANY (QU)? AirPort-Extreme.local. ANY (QU)? AirPort-Extreme.local. ANY (QU)? VjUFSr1HXFe6xSdkEhH+rA@7OJwS232XUKrbbzgdlqz3A._acp-sync._tcp.local. ANY (QU)? AirPort Extreme._airport._tcp.local. (365)
18:11:20.329282 IP 10.0.1.1.mdns > 224.0.0.251.mdns: 0*- [0q] 7/0/2 (Cache flush) PTR AirPort-Extreme.local., PTR _sleep-proxy._udp.local., SRV airport-extreme.local.:13568 0 0, (Cache flush) PTR AirPort-Extreme.local., PTR _acp-sync._tcp.local., PTR _airport._tcp.local., TXT "model=AirPort5,117" (392)
18:11:20.329949 IP6 airport-extreme.local.mdns > ff02::fb.mdns: 0*- [0q] 7/0/2 (Cache flush) PTR AirPort-Extreme.local., PTR _sleep-proxy._udp.local., SRV airport-extreme.local.:13568 0 0, (Cache flush) PTR AirPort-Extreme.local., PTR _acp-sync._tcp.local., PTR _airport._tcp.local., TXT "model=AirPort5,117" (392)
18:11:20.634059 IP 10.0.1.1.mdns > 224.0.0.251.mdns: 0 [5q] [5n] ANY (QM)? 30-35-10-70.1 AirPort Extreme._sleep-proxy._udp.local. ANY (QM)? AirPort-Extreme.local. ANY (QM)? AirPort-Extreme.local. ANY (QM)? VjUFSr1HXFe6xSdkEhH+rA@7OJwS232XUKrbbzgdlqz3A._acp-sync._tcp.local. ANY (QM)? AirPort Extreme._airport._tcp.local. (301)
18:11:20.634857 IP6 airport-extreme.local.mdns > ff02::fb.mdns: 0 [5q] [5n] ANY (QM)? 30-35-10-70.1 AirPort Extreme._sleep-proxy._udp.local. ANY (QM)? AirPort-Extreme.local. ANY (QM)? AirPort-Extreme.local. ANY (QM)? VjUFSr1HXFe6xSdkEhH+rA@7OJwS232XUKrbbzgdlqz3A._acp-sync._tcp.local. ANY (QM)? AirPort Extreme._airport._tcp.local. (301)
18:11:20.634862 IP 10.0.1.19.winfs > 10.0.1.93.56312: Flags [P.], seq 1598200893:1598200901, ack 3010406254, win 33580, options [nop,nop,TS val 1224 ecr 451201999], length 8
18:11:20.634970 IP 10.0.1.93.56312 > 10.0.1.19.winfs: Flags [.], ack 8, win 4095, options [nop,nop,TS val 451604330 ecr 1224], length 0
18:11:20.635467 IP 10.0.1.19.winfs > 10.0.1.93.56312: Flags [P.], seq 8:137, ack 1, win 33580, options [nop,nop,TS val 1224 ecr 451201999], length 129
18:11:20.635541 IP 10.0.1.93.56312 > 10.0.1.19.winfs: Flags [.], ack 137, win 4091, options [nop,nop,TS val 451604330 ecr 1224], length 0
18:11:20.911647 IP 10.0.1.93.mdns > 224.0.0.251.mdns: 0 PTR (QU)? a.1.7.1.2.9.f.5.a.4.b.7.7.7.4.1.0.0.0.0.0.0.0.0.0.0.0.0.0.8.e.f.ip6.arpa. (90)
18:11:20.941007 IP6 fe80::1477:7b4a:5f92:171a > ff02::2: ICMP6, router solicitation, length 16
18:11:20.941096 IP 10.0.1.123.mdns > 224.0.0.251.mdns: 0 [3q] PTR (QM)? _233637DE._sub._googlecast._tcp.local. PTR (QM)? _CA5E8412._sub._googlecast._tcp.local. PTR (QM)? _googlecast._tcp.local. (77)
18:11:20.941869 IP 10.0.1.1.mdns > 224.0.0.251.mdns: 0 [5q] [5n] ANY (QM)? 30-35-10-70.1 AirPort Extreme._sleep-proxy._udp.local. ANY (QM)? AirPort-Extreme.local. ANY (QM)? AirPort-Extreme.local. ANY (QM)? VjUFSr1HXFe6xSdkEhH+rA@7OJwS232XUKrbbzgdlqz3A._acp-sync._tcp.local. ANY (QM)? AirPort Extreme._airport._tcp.local. (301)
18:11:20.942271 IP6 airport-extreme.local.mdns > ff02::fb.mdns: 0 [5q] [5n] ANY (QM)? 30-35-10-70.1 AirPort Extreme._sleep-proxy._udp.local. ANY (QM)? AirPort-Extreme.local. ANY (QM)? AirPort-Extreme.local. ANY (QM)? VjUFSr1HXFe6xSdkEhH+rA@7OJwS232XUKrbbzgdlqz3A._acp-sync._tcp.local. ANY (QM)? AirPort Extreme._airport._tcp.local. (301)
18:11:21.080550 IP 10.0.1.93.56684 > a104-89-14-212.deploy.static.akamaitechnologies.com.http: Flags [.], ack 2449150577, win 4096, length 0
18:11:21.102726 IP a104-89-14-212.deploy.static.akamaitechnologies.com.http > 10.0.1.93.56684: Flags [R], seq 2449150577, win 0, length 0
18:11:21.234942 IP 10.0.1.93.46701 > 10.0.1.1.domain: 47335+ A? clients2.google.com. (37)
18:11:21.248234 IP 10.0.1.20.mdns > 224.0.0.251.mdns: 0 [1a] [1au] PTR (QM)? _sleep-proxy._udp.local. (114)
18:11:21.248418 IP6 fe80::1477:7b4a:5f92:171a.mdns > ff02::fb.mdns: 0 [1a] [1au] PTR (QM)? _sleep-proxy._udp.local. (114)
18:11:21.250626 IP 10.0.1.1.mdns > 224.0.0.251.mdns: 0*- [0q] 26/0/4 (Cache flush) TXT "", PTR 30-35-10-70.1 AirPort Extreme._sleep-proxy._udp.local., (Cache flush) TXT "cu=4dde65b7-ee90-555f-a5a9-f20ee14e9322" "nm=AirPort Extreme" "mac=B8:C7:5D:CD:FC:07" "ssid=hwf.io" "bssinfo=AQIGUYYAAAAGKM/asvcLlX6WCAAAByjP2rL3DA", PTR VjUFSr1HXFe6xSdkEhH+rA@7OJwS232XUKrbbzgdlqz3A._acp-sync._tcp.local., (Cache flush) TXT "waMA=B8-C7-5D-CD-FC-07,raMA=28-CF-DA-B2-F7-0B,raM2=28-CF-DA-B2-F7-0C,raNm=hwf.io,raCh=6,rCh2=149,raSt=0,raNA=1,syFl=0x820C,syAP=117,syVs=7.6.8,srcv=76800.1,bjSd=29", PTR AirPort Extreme._airport._tcp.local., TXT "model=AirPort5,117", (Cache flush) SRV AirPort-Extreme.local.:60787 0 0, (Cache flush) A 10.0.1.1, (Cache flush) AAAA fe80::bac7:5dff:fecd:fc07, (Cache flush) SRV AirPort-Extreme.local.:5009 0 0, (Cache flush) SRV AirPort-Extreme.local.:5009 0 0, PTR _mediaremotetv._tcp.local., PTR Sala._mediaremotetv._tcp.local., TXT "model=J42dAP", PTR _airplay._tcp.local., PTR Sala._airplay._tcp.local., PTR _raop._tcp.local., PTR C869CD6D631A@Sala._raop._tcp.local., (Cache flush) TXT "UniqueIdentifier=867B9AF7-1237-4DEB-80B0-C9F16BFB44E2" "Name=Sala" "SystemBuildVersion=14U712a" "ModelName=" "AllowPairing=YES", (Cache flush) SRV Sala.local.:61171 0 0, (Cache flush) TXT "deviceid=C8:69:CD:6D:63:1A" "features=0x5A7FFFF7,0x4DE" "flags=0x44" "model=AppleTV5,3" "pi=11a28c17-5f05-4710-901b-becbf940154d" "pk=67b530684f5e738ea639e976e73fb9315d06c7940f6ef5613bfb27c103709344" "srcvers=310.17" "vv=2", (Cache flush) SRV Sala.local.:7000 0 0, (Cache flush) SRV Sala.local.:7000 0 0, (Cache flush) AAAA fe80::27:bb22:ed7d:baf6, (Cache flush) A 10.0.1.2 (1448)
18:11:21.252582 IP6 airport-extreme.local > ff02::fb: frag (0|1232) mdns > mdns: 0*- [0q] 26/0/4 (Cache flush) TXT "", PTR 30-35-10-70.1 AirPort Extreme._sleep-proxy._udp.local., (Cache flush) TXT "cu=4dde65b7-ee90-555f-a5a9-f20ee14e9322" "nm=AirPort Extreme" "mac=B8:C7:5D:CD:FC:07" "ssid=hwf.io" "bssinfo=AQIGUYYAAAAGKM/asvcLlX6WCAAAByjP2rL3DA", PTR VjUFSr1HXFe6xSdkEhH+rA@7OJwS232XUKrbbzgdlqz3A._acp-sync._tcp.local., (Cache flush) TXT "waMA=B8-C7-5D-CD-FC-07,raMA=28-CF-DA-B2-F7-0B,raM2=28-CF-DA-B2-F7-0C,raNm=hwf.io,raCh=6,rCh2=149,raSt=0,raNA=1,syFl=0x820C,syAP=117,syVs=7.6.8,srcv=76800.1,bjSd=29", PTR AirPort Extreme._airport._tcp.local., TXT "model=AirPort5,117", (Cache flush) SRV AirPort-Extreme.local.:60787 0 0, (Cache flush) A 10.0.1.1, (Cache flush) AAAA fe80::bac7:5dff:fecd:fc07, (Cache flush) SRV AirPort-Extreme.local.:5009 0 0, (Cache flush) SRV AirPort-Extreme.local.:5009 0 0, PTR _mediaremotetv._tcp.local., PTR Sala._mediaremotetv._tcp.local., TXT "model=J42dAP", PTR _airplay._tcp.local., PTR Sala._airplay._tcp.local., PTR _raop._tcp.local., PTR C869CD6D631A@Sala._raop._tcp.local., (Cache flush) TXT "UniqueIdentifier=867B9AF7-1237-4DEB-80B0-C9F16BFB44E2" "Name=Sala" "SystemBuildVersion=14U712a" "ModelName=" "AllowPairing=YES", (Cache flush) SRV Sala.local.:61171 0 0, (Cache flush) TXT[|domain]
18:11:21.252990 IP6 airport-extreme.local > ff02::fb: frag (1232|224)
18:11:21.253444 IP 10.0.1.1.mdns > 224.0.0.251.mdns: 0*- [0q] 1/0/0 (Cache flush) TXT "cn=0,1,2,3" "da=true" "et=0,3,5" "ft=0x5A7FFFF7,0x4DE" "sf=0x44" "md=0,1,2" "am=AppleTV5,3" "pk=67b530684f5e738ea639e976e73fb9315d06c7940f6ef5613bfb27c103709344" "tp=UDP" "vn=65537" "vs=310.17" "vv=2" (236)
18:11:21.254038 IP6 airport-extreme.local.mdns > ff02::fb.mdns: 0*- [0q] 1/0/0 (Cache flush) TXT "cn=0,1,2,3" "da=true" "et=0,3,5" "ft=0x5A7FFFF7,0x4DE" "sf=0x44" "md=0,1,2" "am=AppleTV5,3" "pk=67b530684f5e738ea639e976e73fb9315d06c7940f6ef5613bfb27c103709344" "tp=UDP" "vn=65537" "vs=310.17" "vv=2" (236)
18:11:21.254517 IP 10.0.1.19.mdns > 224.0.0.251.mdns: 0*- [0q] 1/0/7 PTR 50-35-10-70.1 AirPort Express._sleep-proxy._udp.local. (229)
18:11:21.254869 IP6 airport-express.local.mdns > ff02::fb.mdns: 0*- [0q] 1/0/7 PTR 50-35-10-70.1 AirPort Express._sleep-proxy._udp.local. (229)
18:11:21.366798 IP 10.0.1.93.56589 > mx1.plstechnology.net.https: Flags [F.], seq 1887371115, ack 1618842688, win 8761, options [nop,nop,TS val 451605060 ecr 69019516], length 0
18:11:21.367051 IP 10.0.1.93.56816 > 63.241.108.103.https: Flags [F.], seq 1527646287, ack 798795637, win 4120, options [nop,nop,TS val 451605060 ecr 724171220], length 0
18:11:21.367051 IP 10.0.1.93.56666 > a104-89-14-178.deploy.static.akamaitechnologies.com.http: Flags [F.], seq 2980632641, ack 1627694095, win 4096, options [nop,nop,TS val 451605060 ecr 1330599881], length 0
18:11:21.367099 IP 10.0.1.93.56669 > a104-89-14-178.deploy.static.akamaitechnologies.com.http: Flags [F.], seq 4155749674, ack 1614692636, win 4096, options [nop,nop,TS val 451605060 ecr 1330599888], length 0
18:11:21.367099 IP 10.0.1.93.56680 > rio01s21-in-f66.1e100.net.http: Flags [F.], seq 1, ack 1, win 4117, options [nop,nop,TS val 451605060 ecr 1293281331], length 0
18:11:21.377147 IP 10.0.1.1.domain > 10.0.1.93.46701: 47335 9/0/0 CNAME clients.l.google.com., A 191.34.252.86, A 191.34.252.89, A 191.34.252.90, A 191.34.252.88, A 191.34.252.87, A 191.34.252.85, A 191.34.252.84, A 191.34.252.91 (189)
18:11:21.380579 IP 10.0.1.93.58742 > 191.34.252.86.dynamic.adsl.gvt.net.br.https: UDP, length 1350
18:11:21.380716 IP 10.0.1.93.56826 > 191.34.252.86.dynamic.adsl.gvt.net.br.https: Flags [S], seq 3578861913, win 65535, options [mss 1460,nop,wscale 5,nop,nop,TS val 451605073 ecr 0,sackOK,eol], length 0
18:11:21.381097 IP 10.0.1.93.58742 > 191.34.252.86.dynamic.adsl.gvt.net.br.https: UDP, length 1185
18:11:21.389614 IP a104-89-14-178.deploy.static.akamaitechnologies.com.http > 10.0.1.93.56669: Flags [.], ack 1, win 944, options [nop,nop,TS val 1330619486 ecr 451605060], length 0
18:11:21.390065 IP a104-89-14-178.deploy.static.akamaitechnologies.com.http > 10.0.1.93.56666: Flags [.], ack 1, win 944, options [nop,nop,TS val 1330619487 ecr 451605060], length 0
18:11:21.401613 IP 191.34.252.86.dynamic.adsl.gvt.net.br.https > 10.0.1.93.56826: Flags [S.], seq 3809867097, ack 3578861914, win 28960, options [mss 1400,sackOK,TS val 2572076215 ecr 451605073,nop,wscale 7], length 0
18:11:21.401700 IP 10.0.1.93.56826 > 191.34.252.86.dynamic.adsl.gvt.net.br.https: Flags [.], ack 1, win 4120, options [nop,nop,TS val 451605093 ecr 2572076215], length 0
18:11:21.401929 IP 10.0.1.93.56826 > 191.34.252.86.dynamic.adsl.gvt.net.br.https: Flags [P.], seq 1:208, ack 1, win 4120, options [nop,nop,TS val 451605093 ecr 2572076215], length 207
18:11:21.431417 IP 191.34.252.86.dynamic.adsl.gvt.net.br.https > 10.0.1.93.56826: Flags [.], ack 208, win 235, options [nop,nop,TS val 2572076238 ecr 451605093], length 0
18:11:21.435523 IP rio01s21-in-f66.1e100.net.http > 10.0.1.93.56680: Flags [.], ack 2, win 341, options [nop,nop,TS val 1293282878 ecr 451605060], length 0
18:11:21.459929 IP 191.34.252.86.dynamic.adsl.gvt.net.br.https > 10.0.1.93.58742: UDP, length 1350
18:11:21.461066 IP 191.34.252.86.dynamic.adsl.gvt.net.br.https > 10.0.1.93.58742: UDP, length 1350
18:11:21.464182 IP 10.0.1.93.58742 > 191.34.252.86.dynamic.adsl.gvt.net.br.https: UDP, length 1350
18:11:21.464182 IP 10.0.1.93.58742 > 191.34.252.86.dynamic.adsl.gvt.net.br.https: UDP, length 1181
18:11:21.482911 IP 191.34.252.86.dynamic.adsl.gvt.net.br.https > 10.0.1.93.56826: Flags [.], seq 1:1389, ack 208, win 235, options [nop,nop,TS val 2572076295 ecr 451605093], length 1388
18:11:21.483684 IP 191.34.252.86.dynamic.adsl.gvt.net.br.https > 10.0.1.93.56826: Flags [P.], seq 1389:2049, ack 208, win 235, options [nop,nop,TS val 2572076295 ecr 451605093], length 660
18:11:21.483758 IP 10.0.1.93.56826 > 191.34.252.86.dynamic.adsl.gvt.net.br.https: Flags [.], ack 2049, win 4075, options [nop,nop,TS val 451605173 ecr 2572076295], length 0
18:11:21.484514 IP 191.34.252.86.dynamic.adsl.gvt.net.br.https > 10.0.1.93.56826: Flags [.], seq 2049:3437, ack 208, win 235, options [nop,nop,TS val 2572076295 ecr 451605093], length 1388
18:11:21.484869 IP 191.34.252.86.dynamic.adsl.gvt.net.br.https > 10.0.1.93.56826: Flags [P.], seq 3437:4097, ack 208, win 235, options [nop,nop,TS val 2572076295 ecr 451605093], length 660
18:11:21.484912 IP 10.0.1.93.56826 > 191.34.252.86.dynamic.adsl.gvt.net.br.https: Flags [.], ack 4097, win 4075, options [nop,nop,TS val 451605174 ecr 2572076295], length 0
18:11:21.485270 IP 191.34.252.86.dynamic.adsl.gvt.net.br.https > 10.0.1.93.56826: Flags [P.], seq 4097:4401, ack 208, win 235, options [nop,nop,TS val 2572076295 ecr 451605093], length 304
18:11:21.485275 IP 191.34.252.86.dynamic.adsl.gvt.net.br.https > 10.0.1.93.58742: UDP, length 35
18:11:21.485327 IP 10.0.1.93.56826 > 191.34.252.86.dynamic.adsl.gvt.net.br.https: Flags [.], ack 4401, win 4086, options [nop,nop,TS val 451605174 ecr 2572076295], length 0
18:11:21.486721 IP 10.0.1.93.56826 > 191.34.252.86.dynamic.adsl.gvt.net.br.https: Flags [P.], seq 208:301, ack 4401, win 4096, options [nop,nop,TS val 451605176 ecr 2572076295], length 93
18:11:21.488604 IP 10.0.1.93.56826 > 191.34.252.86.dynamic.adsl.gvt.net.br.https: Flags [P.], seq 301:354, ack 4401, win 4096, options [nop,nop,TS val 451605177 ecr 2572076295], length 53
18:11:21.488605 IP 10.0.1.93.56826 > 191.34.252.86.dynamic.adsl.gvt.net.br.https: Flags [P.], seq 354:410, ack 4401, win 4096, options [nop,nop,TS val 451605177 ecr 2572076295], length 56
18:11:21.488651 IP 10.0.1.93.56826 > 191.34.252.86.dynamic.adsl.gvt.net.br.https: Flags [P.], seq 410:452, ack 4401, win 4096, options [nop,nop,TS val 451605177 ecr 2572076295], length 42
18:11:21.489471 IP 10.0.1.93.58742 > 191.34.252.86.dynamic.adsl.gvt.net.br.https: UDP, length 38
18:11:21.509212 IP 191.34.252.86.dynamic.adsl.gvt.net.br.https > 10.0.1.93.56826: Flags [.], ack 301, win 235, options [nop,nop,TS val 2572076323 ecr 451605176], length 0
18:11:21.514514 IP mx1.plstechnology.net.https > 10.0.1.93.56589: Flags [.], ack 1, win 2092, options [nop,nop,TS val 69023610 ecr 451605060], length 0
18:11:21.516686 IP 191.34.252.86.dynamic.adsl.gvt.net.br.https > 10.0.1.93.56826: Flags [.], ack 357, win 235, options [nop,nop,TS val 2572076325 ecr 451605177], length 0
18:11:21.523744 IP 63.241.108.103.https > 10.0.1.93.56816: Flags [F.], seq 1, ack 1, win 5600, options [nop,nop,TS val 724179576 ecr 451605060], length 0
18:11:21.523877 IP 10.0.1.93.56816 > 63.241.108.103.https: Flags [.], ack 2, win 4120, options [nop,nop,TS val 451605211 ecr 724179576], length 0
18:11:21.544224 IP 191.34.252.86.dynamic.adsl.gvt.net.br.https > 10.0.1.93.58742: UDP, length 1350
18:11:21.544243 IP 191.34.252.86.dynamic.adsl.gvt.net.br.https > 10.0.1.93.58742: UDP, length 38
18:11:21.552392 IP 191.34.252.86.dynamic.adsl.gvt.net.br.https > 10.0.1.93.58742: UDP, length 38
18:11:21.554013 IP 10.0.1.93.51413 > rio01s22-in-f5.1e100.net.https: UDP, length 23
18:11:21.555195 IP 10.0.1.93.56710 > rio01s22-in-f2.1e100.net.http: Flags [.], ack 2748286613, win 4096, length 0
18:11:21.555454 IP 10.0.1.1.mdns > 224.0.0.251.mdns: 0 [2a] PTR (QM)? _acp-sync._tcp.local. (158)
18:11:21.555966 IP6 airport-extreme.local.mdns > ff02::fb.mdns: 0 [2a] PTR (QM)? _acp-sync._tcp.local. (158)
18:11:21.556614 IP 10.0.1.1.mdns > 224.0.0.251.mdns: 0*- [0q] 6/0/2 (Cache flush) PTR AirPort-Extreme.local., PTR _sleep-proxy._udp.local., SRV airport-extreme.local.:13568 0 0, (Cache flush) PTR AirPort-Extreme.local., PTR _acp-sync._tcp.local., PTR _airport._tcp.local. (332)
18:11:21.557253 IP6 airport-extreme.local.mdns > ff02::fb.mdns: 0*- [0q] 6/0/2 (Cache flush) PTR AirPort-Extreme.local., PTR _sleep-proxy._udp.local., SRV airport-extreme.local.:13568 0 0, (Cache flush) PTR AirPort-Extreme.local., PTR _acp-sync._tcp.local., PTR _airport._tcp.local. (332)
18:11:21.557698 IP 10.0.1.18.mdns > 224.0.0.251.mdns: 0*- [0q] 1/0/6 PTR 70-35-60-63.1 Quarto._sleep-proxy._udp.local. (195)
18:11:21.558065 IP6 quarto.local.mdns > ff02::fb.mdns: 0*- [0q] 1/0/6 PTR 70-35-60-63.1 Quarto._sleep-proxy._udp.local. (195)
18:11:21.566316 IP 191.34.252.86.dynamic.adsl.gvt.net.br.https > 10.0.1.93.56826: Flags [P.], seq 4401:4663, ack 357, win 235, options [nop,nop,TS val 2572076380 ecr 451605177], length 262
18:11:21.566480 IP 191.34.252.86.dynamic.adsl.gvt.net.br.https > 10.0.1.93.56826: Flags [P.], seq 4663:4719, ack 357, win 235, options [nop,nop,TS val 2572076380 ecr 451605177], length 56
18:11:21.566499 IP 10.0.1.93.56826 > 191.34.252.86.dynamic.adsl.gvt.net.br.https: Flags [.], ack 4663, win 4087, options [nop,nop,TS val 451605253 ecr 2572076380], length 0
18:11:21.566543 IP 10.0.1.93.56826 > 191.34.252.86.dynamic.adsl.gvt.net.br.https: Flags [.], ack 4719, win 4094, options [nop,nop,TS val 451605253 ecr 2572076380], length 0
18:11:21.566642 IP 10.0.1.93.56826 > 191.34.252.86.dynamic.adsl.gvt.net.br.https: Flags [P.], seq 452:490, ack 4719, win 4096, options [nop,nop,TS val 451605253 ecr 2572076380], length 38
18:11:21.566820 IP 191.34.252.86.dynamic.adsl.gvt.net.br.https > 10.0.1.93.56826: Flags [P.], seq 4719:4761, ack 357, win 235, options [nop,nop,TS val 2572076380 ecr 451605177], length 42
18:11:21.566870 IP 10.0.1.93.56826 > 191.34.252.86.dynamic.adsl.gvt.net.br.https: Flags [.], ack 4761, win 4094, options [nop,nop,TS val 451605253 ecr 2572076380], length 0
18:11:21.570453 IP 10.0.1.93.58742 > 191.34.252.86.dynamic.adsl.gvt.net.br.https: UDP, length 41
18:11:21.577381 IP 191.34.252.86.dynamic.adsl.gvt.net.br.https > 10.0.1.93.56826: Flags [.], ack 357, win 243, options [nop,nop,TS val 2572076390 ecr 451605177,nop,nop,sack 1 {452:490}], length 0
18:11:21.577497 IP 10.0.1.93.56826 > 191.34.252.86.dynamic.adsl.gvt.net.br.https: Flags [.], seq 357:452, ack 4761, win 4096, options [nop,nop,TS val 451605264 ecr 2572076390], length 95
18:11:21.592603 IP 191.34.252.86.dynamic.adsl.gvt.net.br.https > 10.0.1.93.56826: Flags [.], ack 490, win 243, options [nop,nop,TS val 2572076402 ecr 451605264], length 0
18:11:21.616558 IP rio01s22-in-f2.1e100.net.http > 10.0.1.93.56710: Flags [.], ack 1, win 387, options [nop,nop,TS val 3859773301 ecr 451379802], length 0
18:11:21.636114 IP rio01s22-in-f5.1e100.net.https > 10.0.1.93.51413: UDP, length 31
18:11:21.646240 IP 191.34.252.86.dynamic.adsl.gvt.net.br.https > 10.0.1.93.56826: Flags [P.], seq 4761:4799, ack 490, win 243, options [nop,nop,TS val 2572076460 ecr 451605264], length 38
18:11:21.646320 IP 10.0.1.93.56826 > 191.34.252.86.dynamic.adsl.gvt.net.br.https: Flags [.], ack 4799, win 4094, options [nop,nop,TS val 451605330 ecr 2572076460], length 0
18:11:21.799705 IP 191.34.252.86.dynamic.adsl.gvt.net.br.https > 10.0.1.93.58742: UDP, length 318
18:11:21.800000 IP 191.34.252.86.dynamic.adsl.gvt.net.br.https > 10.0.1.93.58742: UDP, length 685
18:11:21.800257 IP 10.0.1.93.58742 > 191.34.252.86.dynamic.adsl.gvt.net.br.https: UDP, length 38
18:11:21.913813 IP 10.0.1.93.mdns > 224.0.0.251.mdns: 0 PTR (QM)? a.1.7.1.2.9.f.5.a.4.b.7.7.7.4.1.0.0.0.0.0.0.0.0.0.0.0.0.0.8.e.f.ip6.arpa. (90)
18:11:22.172133 IP 10.0.1.1.mdns > 224.0.0.251.mdns: 0*- [0q] 26/0/4 (Cache flush) TXT "", PTR 30-35-10-70.1 AirPort Extreme._sleep-proxy._udp.local., (Cache flush) TXT "cu=4dde65b7-ee90-555f-a5a9-f20ee14e9322" "nm=AirPort Extreme" "mac=B8:C7:5D:CD:FC:07" "ssid=hwf.io" "bssinfo=AQIGUYYAAAAGKM/asvcLlX6WCAAAByjP2rL3DA", PTR VjUFSr1HXFe6xSdkEhH+rA@7OJwS232XUKrbbzgdlqz3A._acp-sync._tcp.local., (Cache flush) TXT "waMA=B8-C7-5D-CD-FC-07,raMA=28-CF-DA-B2-F7-0B,raM2=28-CF-DA-B2-F7-0C,raNm=hwf.io,raCh=6,rCh2=149,raSt=0,raNA=1,syFl=0x820C,syAP=117,syVs=7.6.8,srcv=76800.1,bjSd=29", PTR AirPort Extreme._airport._tcp.local., TXT "model=AirPort5,117", (Cache flush) SRV AirPort-Extreme.local.:60787 0 0, (Cache flush) A 10.0.1.1, (Cache flush) AAAA fe80::bac7:5dff:fecd:fc07, (Cache flush) SRV AirPort-Extreme.local.:5009 0 0, (Cache flush) SRV AirPort-Extreme.local.:5009 0 0, PTR _mediaremotetv._tcp.local., PTR Sala._mediaremotetv._tcp.local., TXT "model=J42dAP", PTR _airplay._tcp.local., PTR Sala._airplay._tcp.local., PTR _raop._tcp.local., PTR C869CD6D631A@Sala._raop._tcp.local., (Cache flush) TXT "UniqueIdentifier=867B9AF7-1237-4DEB-80B0-C9F16BFB44E2" "Name=Sala" "SystemBuildVersion=14U712a" "ModelName=" "AllowPairing=YES", (Cache flush) SRV Sala.local.:61171 0 0, (Cache flush) TXT "deviceid=C8:69:CD:6D:63:1A" "features=0x5A7FFFF7,0x4DE" "flags=0x44" "model=AppleTV5,3" "pi=11a28c17-5f05-4710-901b-becbf940154d" "pk=67b530684f5e738ea639e976e73fb9315d06c7940f6ef5613bfb27c103709344" "srcvers=310.17" "vv=2", (Cache flush) SRV Sala.local.:7000 0 0, (Cache flush) SRV Sala.local.:7000 0 0, (Cache flush) AAAA fe80::27:bb22:ed7d:baf6, (Cache flush) A 10.0.1.2 (1448)
18:11:22.173904 IP6 airport-extreme.local > ff02::fb: frag (0|1232) mdns > mdns: 0*- [0q] 26/0/4 (Cache flush) TXT "", PTR 30-35-10-70.1 AirPort Extreme._sleep-proxy._udp.local., (Cache flush) TXT "cu=4dde65b7-ee90-555f-a5a9-f20ee14e9322" "nm=AirPort Extreme" "mac=B8:C7:5D:CD:FC:07" "ssid=hwf.io" "bssinfo=AQIGUYYAAAAGKM/asvcLlX6WCAAAByjP2rL3DA", PTR VjUFSr1HXFe6xSdkEhH+rA@7OJwS232XUKrbbzgdlqz3A._acp-sync._tcp.local., (Cache flush) TXT "waMA=B8-C7-5D-CD-FC-07,raMA=28-CF-DA-B2-F7-0B,raM2=28-CF-DA-B2-F7-0C,raNm=hwf.io,raCh=6,rCh2=149,raSt=0,raNA=1,syFl=0x820C,syAP=117,syVs=7.6.8,srcv=76800.1,bjSd=29", PTR AirPort Extreme._airport._tcp.local., TXT "model=AirPort5,117", (Cache flush) SRV AirPort-Extreme.local.:60787 0 0, (Cache flush) A 10.0.1.1, (Cache flush) AAAA fe80::bac7:5dff:fecd:fc07, (Cache flush) SRV AirPort-Extreme.local.:5009 0 0, (Cache flush) SRV AirPort-Extreme.local.:5009 0 0, PTR _mediaremotetv._tcp.local., PTR Sala._mediaremotetv._tcp.local., TXT "model=J42dAP", PTR _airplay._tcp.local., PTR Sala._airplay._tcp.local., PTR _raop._tcp.local., PTR C869CD6D631A@Sala._raop._tcp.local., (Cache flush) TXT "UniqueIdentifier=867B9AF7-1237-4DEB-80B0-C9F16BFB44E2" "Name=Sala" "SystemBuildVersion=14U712a" "ModelName=" "AllowPairing=YES", (Cache flush) SRV Sala.local.:61171 0 0, (Cache flush) TXT[|domain]
18:11:22.174352 IP6 airport-extreme.local > ff02::fb: frag (1232|224)
18:11:22.174839 IP 10.0.1.1.mdns > 224.0.0.251.mdns: 0*- [0q] 1/0/0 (Cache flush) TXT "cn=0,1,2,3" "da=true" "et=0,3,5" "ft=0x5A7FFFF7,0x4DE" "sf=0x44" "md=0,1,2" "am=AppleTV5,3" "pk=67b530684f5e738ea639e976e73fb9315d06c7940f6ef5613bfb27c103709344" "tp=UDP" "vn=65537" "vs=310.17" "vv=2" (236)
18:11:22.175363 IP6 airport-extreme.local.mdns > ff02::fb.mdns: 0*- [0q] 1/0/0 (Cache flush) TXT "cn=0,1,2,3" "da=true" "et=0,3,5" "ft=0x5A7FFFF7,0x4DE" "sf=0x44" "md=0,1,2" "am=AppleTV5,3" "pk=67b530684f5e738ea639e976e73fb9315d06c7940f6ef5613bfb27c103709344" "tp=UDP" "vn=65537" "vs=310.17" "vv=2" (236)
18:11:22.418930 IP 10.0.1.93.55700 > ce-in-f189.1e100.net.https: UDP, length 23
18:11:22.560623 IP ce-in-f189.1e100.net.https > 10.0.1.93.55700: UDP, length 30
18:11:23.091671 IP 10.0.1.20 > igmp.mcast.net: igmp v3 report, 1 group record(s)
18:11:23.091676 IP6 fe80::1477:7b4a:5f92:171a > ff02::16: HBH ICMP6, multicast listener report v2, 1 group record(s), length 28
18:11:23.769570 IP rio01s15-in-f2.1e100.net.https > 10.0.1.93.56702: Flags [P.], seq 1:64, ack 1, win 350, options [nop,nop,TS val 679825238 ecr 451374152], length 63
18:11:23.769573 IP rio01s15-in-f2.1e100.net.https > 10.0.1.93.56702: Flags [F.], seq 64, ack 1, win 350, options [nop,nop,TS val 679825238 ecr 451374152], length 0
18:11:23.769635 IP 10.0.1.93.56702 > rio01s15-in-f2.1e100.net.https: Flags [.], ack 64, win 4094, options [nop,nop,TS val 451607452 ecr 679825238], length 0
18:11:23.769635 IP 10.0.1.93.56702 > rio01s15-in-f2.1e100.net.https: Flags [.], ack 65, win 4094, options [nop,nop,TS val 451607452 ecr 679825238], length 0
18:11:23.769738 IP 10.0.1.93.56702 > rio01s15-in-f2.1e100.net.https: Flags [F.], seq 1, ack 65, win 4096, options [nop,nop,TS val 451607452 ecr 679825238], length 0
18:11:23.862036 IP rio01s15-in-f2.1e100.net.https > 10.0.1.93.56702: Flags [.], ack 2, win 350, options [nop,nop,TS val 679825461 ecr 451607452], length 0
18:11:24.757652 IP 10.0.1.19.winfs > 10.0.1.93.56312: Flags [P.], seq 137:145, ack 1, win 33580, options [nop,nop,TS val 1232 ecr 451201999], length 8
18:11:24.757656 IP 10.0.1.19.winfs > 10.0.1.93.56312: Flags [P.], seq 145:274, ack 1, win 33580, options [nop,nop,TS val 1232 ecr 451201999], length 129
18:11:24.757723 IP 10.0.1.93.56312 > 10.0.1.19.winfs: Flags [.], ack 145, win 4095, options [nop,nop,TS val 451608439 ecr 1232], length 0
18:11:24.757724 IP 10.0.1.93.56312 > 10.0.1.19.winfs: Flags [.], ack 274, win 4091, options [nop,nop,TS val 451608439 ecr 1232], length 0
18:11:24.933136 IP 10.0.1.93.mdns > 224.0.0.251.mdns: 0 PTR (QM)? a.1.7.1.2.9.f.5.a.4.b.7.7.7.4.1.0.0.0.0.0.0.0.0.0.0.0.0.0.8.e.f.ip6.arpa. (90)
18:11:24.935300 IP6 fe80::1477:7b4a:5f92:171a > ff02::2: ICMP6, router solicitation, length 16
18:11:24.935303 IP 10.0.1.1.mdns > 224.0.0.251.mdns: 0 [5q] [5n] ANY (QM)? 30-35-10-70.1 AirPort Extreme._sleep-proxy._udp.local. ANY (QM)? AirPort-Extreme.local. ANY (QM)? AirPort-Extreme.local. ANY (QM)? VjUFSr1HXFe6xSdkEhH+rA@7OJwS232XUKrbbzgdlqz3A._acp-sync._tcp.local. ANY (QM)? AirPort Extreme._airport._tcp.local. (301)
18:11:24.935986 IP6 airport-extreme.local.mdns > ff02::fb.mdns: 0 [5q] [5n] ANY (QM)? 30-35-10-70.1 AirPort Extreme._sleep-proxy._udp.local. ANY (QM)? AirPort-Extreme.local. ANY (QM)? AirPort-Extreme.local. ANY (QM)? VjUFSr1HXFe6xSdkEhH+rA@7OJwS232XUKrbbzgdlqz3A._acp-sync._tcp.local. ANY (QM)? AirPort Extreme._airport._tcp.local. (301)
18:11:24.935989 IP 10.0.1.20.mdns > 224.0.0.251.mdns: 0 [1au] PTR (QU)? _homekit._tcp.local. (66)
18:11:24.936305 IP6 fe80::1477:7b4a:5f92:171a.mdns > ff02::fb.mdns: 0 [1au] PTR (QU)? _homekit._tcp.local. (66)
18:11:25.887280 IP 10.0.1.93.63548 > 10.0.1.1.domain: 17559+ PTR? 6.1.0.0.0.0.0.0.0.0.0.0.0.0.0.0.0.0.0.0.0.0.0.0.0.0.0.0.2.0.f.f.ip6.arpa. (90)
18:11:25.962785 IP 10.0.1.1.domain > 10.0.1.93.63548: 17559 NXDomain* 0/0/0 (90)
18:11:25.963561 IP 10.0.1.93.58239 > 10.0.1.1.domain: 35269+ PTR? 20.1.0.10.in-addr.arpa. (40)
18:11:25.967123 IP 10.0.1.1.domain > 10.0.1.93.58239: 35269 NXDomain* 0/0/0 (40)
18:11:26.163440 IP 10.0.1.20.mdns > 224.0.0.251.mdns: 0 [1au] PTR (QM)? _homekit._tcp.local. (66)
18:11:26.163681 IP6 fe80::1477:7b4a:5f92:171a.mdns > ff02::fb.mdns: 0 [1au] PTR (QM)? _homekit._tcp.local. (66)
18:11:26.165076 IP 10.0.1.1.mdns > 224.0.0.251.mdns: 0*- [0q] 12/0/4 (Cache flush) TXT "", PTR 30-35-10-70.1 AirPort Extreme._sleep-proxy._udp.local., (Cache flush) TXT "cu=4dde65b7-ee90-555f-a5a9-f20ee14e9322" "nm=AirPort Extreme" "mac=B8:C7:5D:CD:FC:07" "ssid=hwf.io" "bssinfo=AQIGUYYAAAAGKM/asvcLlX6WCAAAByjP2rL3DA", PTR VjUFSr1HXFe6xSdkEhH+rA@7OJwS232XUKrbbzgdlqz3A._acp-sync._tcp.local., (Cache flush) TXT "waMA=B8-C7-5D-CD-FC-07,raMA=28-CF-DA-B2-F7-0B,raM2=28-CF-DA-B2-F7-0C,raNm=hwf.io,raCh=6,rCh2=149,raSt=0,raNA=1,syFl=0x820C,syAP=117,syVs=7.6.8,srcv=76800.1,bjSd=29", PTR AirPort Extreme._airport._tcp.local., TXT "model=AirPort5,117", (Cache flush) SRV AirPort-Extreme.local.:60787 0 0, (Cache flush) A 10.0.1.1, (Cache flush) AAAA fe80::bac7:5dff:fecd:fc07, (Cache flush) SRV AirPort-Extreme.local.:5009 0 0, (Cache flush) SRV AirPort-Extreme.local.:5009 0 0 (797)
18:11:26.166359 IP6 airport-extreme.local.mdns > ff02::fb.mdns: 0*- [0q] 12/0/4 (Cache flush) TXT "", PTR 30-35-10-70.1 AirPort Extreme._sleep-proxy._udp.local., (Cache flush) TXT "cu=4dde65b7-ee90-555f-a5a9-f20ee14e9322" "nm=AirPort Extreme" "mac=B8:C7:5D:CD:FC:07" "ssid=hwf.io" "bssinfo=AQIGUYYAAAAGKM/asvcLlX6WCAAAByjP2rL3DA", PTR VjUFSr1HXFe6xSdkEhH+rA@7OJwS232XUKrbbzgdlqz3A._acp-sync._tcp.local., (Cache flush) TXT "waMA=B8-C7-5D-CD-FC-07,raMA=28-CF-DA-B2-F7-0B,raM2=28-CF-DA-B2-F7-0C,raNm=hwf.io,raCh=6,rCh2=149,raSt=0,raNA=1,syFl=0x820C,syAP=117,syVs=7.6.8,srcv=76800.1,bjSd=29", PTR AirPort Extreme._airport._tcp.local., TXT "model=AirPort5,117", (Cache flush) SRV AirPort-Extreme.local.:60787 0 0, (Cache flush) A 10.0.1.1, (Cache flush) AAAA fe80::bac7:5dff:fecd:fc07, (Cache flush) SRV AirPort-Extreme.local.:5009 0 0, (Cache flush) SRV AirPort-Extreme.local.:5009 0 0 (797)
18:11:26.750399 IP 10.0.1.93.56321 > ce-in-f188.1e100.net.5228: Flags [.], ack 3519762724, win 4096, length 0
18:11:26.971097 IP 10.0.1.93.54520 > 10.0.1.1.domain: 64375+ PTR? 2.0.0.0.0.0.0.0.0.0.0.0.0.0.0.0.0.0.0.0.0.0.0.0.0.0.0.0.2.0.f.f.ip6.arpa. (90)
18:11:26.994295 IP ce-in-f188.1e100.net.5228 > 10.0.1.93.56321: Flags [.], ack 1, win 349, options [nop,nop,TS val 1646945941 ecr 451008134], length 0
18:11:26.994302 IP 10.0.1.1.domain > 10.0.1.93.54520: 64375 NXDomain* 0/0/0 (90)
18:11:27.085301 ARP, Announcement 10.0.1.2, length 46
18:11:27.085306 ARP, Request who-has 10.0.1.1 tell 10.0.1.2, length 46
18:11:27.099298 IP 10.0.1.93.mdns > 224.0.0.251.mdns: 0 PTR (QU)? 6.3.a.e.d.e.e.f.f.f.5.0.7.d.a.4.0.0.0.0.0.0.0.0.0.0.0.0.0.8.e.f.ip6.arpa. (90)
18:11:27.106904 IP 10.0.1.19.mdns > 10.0.1.93.mdns: 0*- [0q] 1/0/0 (Cache flush) PTR AirPort-Express.local. (119)
18:11:27.114946 IP 10.0.1.93.64571 > 10.0.1.1.domain: 6129+ PTR? 103.108.241.63.in-addr.arpa. (45)
18:11:27.392561 IP 10.0.1.2.mdns > 224.0.0.251.mdns: 0 [1au] PTR (QU)? _sleep-proxy._udp.local. (64)
18:11:27.392566 IP6 sala.local.mdns > ff02::fb.mdns: 0 [1au] PTR (QU)? _sleep-proxy._udp.local. (64)
18:11:27.393414 IP 10.0.1.2.mdns > 224.0.0.251.mdns: 0*- [0q] 4/0/3 PTR Sala._airplay._tcp.local., PTR C869CD6D631A@Sala._raop._tcp.local., (Cache flush) PTR Sala.local., (Cache flush) PTR Sala.local. (269)
18:11:27.393982 IP6 sala.local.mdns > ff02::fb.mdns: 0*- [0q] 4/0/3 PTR Sala._airplay._tcp.local., PTR C869CD6D631A@Sala._raop._tcp.local., (Cache flush) PTR Sala.local., (Cache flush) PTR Sala.local. (269)
18:11:27.393988 ARP, Request who-has 10.0.1.1 tell 10.0.1.2, length 46
18:11:27.395645 IP 10.0.1.1.mdns > 224.0.0.251.mdns: 0*- [0q] 18/0/6 (Cache flush) PTR AirPort-Extreme.local., (Cache flush) TXT "", PTR _sleep-proxy._udp.local., PTR 30-35-10-70.1 AirPort Extreme._sleep-proxy._udp.local., SRV airport-extreme.local.:13568 0 0, (Cache flush) PTR AirPort-Extreme.local., (Cache flush) TXT "cu=4dde65b7-ee90-555f-a5a9-f20ee14e9322" "nm=AirPort Extreme" "mac=B8:C7:5D:CD:FC:07" "ssid=hwf.io" "bssinfo=AQIGUYYAAAAGKM/asvcLlX6WCAAAByjP2rL3DA", PTR _acp-sync._tcp.local., PTR VjUFSr1HXFe6xSdkEhH+rA@7OJwS232XUKrbbzgdlqz3A._acp-sync._tcp.local., (Cache flush) TXT "waMA=B8-C7-5D-CD-FC-07,raMA=28-CF-DA-B2-F7-0B,raM2=28-CF-DA-B2-F7-0C,raNm=hwf.io,raCh=6,rCh2=149,raSt=0,raNA=1,syFl=0x820C,syAP=117,syVs=7.6.8,srcv=76800.1,bjSd=29", PTR _airport._tcp.local., PTR AirPort Extreme._airport._tcp.local., TXT "model=AirPort5,117", (Cache flush) SRV AirPort-Extreme.local.:60787 0 0, (Cache flush) A 10.0.1.1, (Cache flush) AAAA fe80::bac7:5dff:fecd:fc07, (Cache flush) SRV AirPort-Extreme.local.:5009 0 0, (Cache flush) SRV AirPort-Extreme.local.:5009 0 0 (1054)
18:11:27.397406 IP6 airport-extreme.local.mdns > ff02::fb.mdns: 0*- [0q] 18/0/6 (Cache flush) PTR AirPort-Extreme.local., (Cache flush) TXT "", PTR _sleep-proxy._udp.local., PTR 30-35-10-70.1 AirPort Extreme._sleep-proxy._udp.local., SRV airport-extreme.local.:13568 0 0, (Cache flush) PTR AirPort-Extreme.local., (Cache flush) TXT "cu=4dde65b7-ee90-555f-a5a9-f20ee14e9322" "nm=AirPort Extreme" "mac=B8:C7:5D:CD:FC:07" "ssid=hwf.io" "bssinfo=AQIGUYYAAAAGKM/asvcLlX6WCAAAByjP2rL3DA", PTR _acp-sync._tcp.local., PTR VjUFSr1HXFe6xSdkEhH+rA@7OJwS232XUKrbbzgdlqz3A._acp-sync._tcp.local., (Cache flush) TXT "waMA=B8-C7-5D-CD-FC-07,raMA=28-CF-DA-B2-F7-0B,raM2=28-CF-DA-B2-F7-0C,raNm=hwf.io,raCh=6,rCh2=149,raSt=0,raNA=1,syFl=0x820C,syAP=117,syVs=7.6.8,srcv=76800.1,bjSd=29", PTR _airport._tcp.local., PTR AirPort Extreme._airport._tcp.local., TXT "model=AirPort5,117", (Cache flush) SRV AirPort-Extreme.local.:60787 0 0, (Cache flush) A 10.0.1.1, (Cache flush) AAAA fe80::bac7:5dff:fecd:fc07, (Cache flush) SRV AirPort-Extreme.local.:5009 0 0, (Cache flush) SRV AirPort-Extreme.local.:5009 0 0 (1054)
18:11:27.397996 IP 10.0.1.1.domain > 10.0.1.93.64571: 6129 NXDomain* 1/0/0 CNAME 103.64/26.108.241.63.in-addr.arpa. (69)
18:11:27.398534 IP 10.0.1.93.64571 > 10.0.1.1.domain: 6129+ PTR? 103.64/26.108.241.63.in-addr.arpa. (51)
18:11:27.400484 IP 10.0.1.1.domain > 10.0.1.93.64571: 6129 NXDomain* 0/0/0 (51)
18:11:27.403163 IP 10.0.1.93.57907 > 10.0.1.1.domain: 33421+ PTR? 18.1.0.10.in-addr.arpa. (40)
18:11:27.405661 IP 10.0.1.1.domain > 10.0.1.93.57907: 33421 NXDomain* 0/0/0 (40)
18:11:27.522596 IP 10.0.1.93.mdns > 224.0.0.251.mdns: 0 PTR (QU)? 5.a.b.1.7.b.1.4.2.7.6.0.f.f.8.1.0.0.0.0.0.0.0.0.0.0.0.0.0.8.e.f.ip6.arpa. (90)
18:11:27.530392 IP 10.0.1.18.mdns > 10.0.1.93.mdns: 0*- [0q] 1/0/1 (Cache flush) PTR Quarto.local. (160)
18:11:27.879842 IP 10.0.1.93.56788 > 179.185.161.11.static.adsl.gvt.net.br.http: Flags [.], ack 3892867892, win 4096, length 0
18:11:27.881498 IP rio01s23-in-f2.1e100.net.https > 10.0.1.93.56738: Flags [P.], seq 1:64, ack 1, win 350, options [nop,nop,TS val 3859779073 ecr 451377874], length 63
18:11:27.881602 IP 10.0.1.93.56738 > rio01s23-in-f2.1e100.net.https: Flags [.], ack 64, win 4094, options [nop,nop,TS val 451611559 ecr 3859779073], length 0
18:11:27.881753 IP 10.0.1.93.56738 > rio01s23-in-f2.1e100.net.https: Flags [F.], seq 1, ack 64, win 4096, options [nop,nop,TS val 451611559 ecr 3859779073], length 0
18:11:27.881903 IP rio01s23-in-f2.1e100.net.https > 10.0.1.93.56738: Flags [F.], seq 64, ack 1, win 350, options [nop,nop,TS val 3859779073 ecr 451377874], length 0
18:11:27.882136 IP 10.0.1.93.56738 > rio01s23-in-f2.1e100.net.https: Flags [F.], seq 1, ack 65, win 4096, options [nop,nop,TS val 451611559 ecr 3859779073], length 0
18:11:27.900562 IP 179.185.161.11.static.adsl.gvt.net.br.http > 10.0.1.93.56788: Flags [.], ack 1, win 939, options [nop,nop,TS val 2554994156 ecr 451386027], length 0
18:11:27.917015 IP 10.0.1.93.56792 > 179.185.161.27.static.adsl.gvt.net.br.http: Flags [.], ack 3794682775, win 4096, length 0
18:11:27.938740 IP 179.185.161.27.static.adsl.gvt.net.br.http > 10.0.1.93.56792: Flags [.], ack 1, win 939, options [nop,nop,TS val 2554111494 ecr 451386298], length 0
18:11:27.939247 IP rio01s23-in-f2.1e100.net.https > 10.0.1.93.56738: Flags [.], ack 2, win 350, options [nop,nop,TS val 3859779155 ecr 451611559], length 0
18:11:28.300142 IP 10.0.1.93.56791 > a23-57-116-169.deploy.static.akamaitechnologies.com.http: Flags [.], ack 1626392113, win 4096, length 0
18:11:28.314096 IP 10.0.1.1.mdns > 224.0.0.251.mdns: 0 [2a] PTR (QM)? _acp-sync._tcp.local. (158)
18:11:28.314337 IP6 airport-extreme.local.mdns > ff02::fb.mdns: 0 [2a] PTR (QM)? _acp-sync._tcp.local. (158)
18:11:28.314925 IP 10.0.1.2.mdns > 224.0.0.251.mdns: 0 [3a] [1au] PTR (QM)? _sleep-proxy._udp.local. (187)
18:11:28.315229 IP6 sala.local.mdns > ff02::fb.mdns: 0 [3a] [1au] PTR (QM)? _sleep-proxy._udp.local. (187)
18:11:28.315477 IP 10.0.1.2.mdns > 224.0.0.251.mdns: 0*- [0q] 1/0/2 (Cache flush) PTR Sala.local. (98)
18:11:28.315984 IP6 sala.local.mdns > ff02::fb.mdns: 0*- [0q] 1/0/2 (Cache flush) PTR Sala.local. (98)
18:11:28.364045 IP a23-57-116-169.deploy.static.akamaitechnologies.com.http > 10.0.1.93.56791: Flags [.], ack 1, win 939, options [nop,nop,TS val 81486180 ecr 451386384], length 0
18:11:28.504941 IP 10.0.1.93.63609 > 10.0.1.1.domain: 25665+ A? e6858.dsce9.akamaiedge.net. (44)
18:11:28.537281 IP 10.0.1.93.56771 > 63.241.108.104.https: Flags [F.], seq 2714518446, ack 3857415541, win 4120, options [nop,nop,TS val 451612213 ecr 724122306], length 0
18:11:28.633383 IP 10.0.1.93.61255 > 10.0.1.1.domain: 60017+ PTR? 27.161.185.179.in-addr.arpa. (45)
18:11:28.633688 IP 10.0.1.93.56790 > a23-57-116-169.deploy.static.akamaitechnologies.com.http: Flags [.], ack 3235139748, win 4096, length 0
18:11:28.633688 IP 10.0.1.93.56789 > a23-57-116-169.deploy.static.akamaitechnologies.com.http: Flags [.], ack 3225294706, win 4096, length 0
18:11:28.653926 IP 10.0.1.1.domain > 10.0.1.93.63609: 25665 1/0/0 A 23.57.146.139 (60)
18:11:28.781596 IP 10.0.1.1.domain > 10.0.1.93.61255: 60017 1/0/0 PTR 179.185.161.27.static.adsl.gvt.net.br. (96)
18:11:28.782526 IP 10.0.1.93.62005 > 10.0.1.1.domain: 25760+ PTR? 169.116.57.23.in-addr.arpa. (44)
18:11:28.783831 IP 10.0.1.93.56319 > rio01s22-in-f6.1e100.net.https: UDP, length 1350
18:11:28.784047 IP 10.0.1.93.56319 > rio01s22-in-f6.1e100.net.https: UDP, length 686
18:11:28.877130 IP rio01s22-in-f6.1e100.net.https > 10.0.1.93.56319: UDP, length 1350
18:11:28.885371 IP rio01s22-in-f6.1e100.net.https > 10.0.1.93.56319: UDP, length 30
18:11:28.890870 IP 10.0.1.93.56319 > rio01s22-in-f6.1e100.net.https: UDP, length 180
18:11:28.909684 IP 10.0.1.1.domain > 10.0.1.93.62005: 25760 1/0/0 PTR a23-57-116-169.deploy.static.akamaitechnologies.com. (109)
18:11:28.910803 IP 10.0.1.93.62676 > 10.0.1.1.domain: 4189+ PTR? 104.64/26.108.241.63.in-addr.arpa. (51)
18:11:28.912496 IP 10.0.1.1.domain > 10.0.1.93.62676: 4189 NXDomain* 0/0/0 (51)
18:11:28.928336 IP 10.0.1.20.mdns > 224.0.0.251.mdns: 0 [1au] PTR (QM)? _homekit._tcp.local. (66)
18:11:28.928427 IP6 fe80::1477:7b4a:5f92:171a.mdns > ff02::fb.mdns: 0 [1au] PTR (QM)? _homekit._tcp.local. (66)
18:11:28.941442 IP rio01s22-in-f6.1e100.net.https > 10.0.1.93.56319: UDP, length 407
18:11:28.967531 IP 10.0.1.93.56319 > rio01s22-in-f6.1e100.net.https: UDP, length 35
18:11:28.982757 IP 10.0.1.93.56319 > rio01s22-in-f6.1e100.net.https: UDP, length 163
18:11:28.995736 IP rio01s22-in-f6.1e100.net.https > 10.0.1.93.56319: UDP, length 27
18:11:29.029770 IP rio01s22-in-f6.1e100.net.https > 10.0.1.93.56319: UDP, length 86
18:11:29.056295 IP 10.0.1.93.56319 > rio01s22-in-f6.1e100.net.https: UDP, length 38
18:11:29.077744 IP rio01s22-in-f6.1e100.net.https > 10.0.1.93.56319: UDP, length 30
18:11:29.111092 IP rio01s22-in-f6.1e100.net.https > 10.0.1.93.56319: UDP, length 109
18:11:29.137661 IP 10.0.1.93.56319 > rio01s22-in-f6.1e100.net.https: UDP, length 38
18:11:29.542887 IP 10.0.1.2.mdns > 224.0.0.251.mdns: 0*- [0q] 1/0/2 (Cache flush) PTR Sala.local. (98)
18:11:29.542894 IP6 sala.local.mdns > ff02::fb.mdns: 0*- [0q] 1/0/2 (Cache flush) PTR Sala.local. (98)
18:11:30.158324 IP 10.0.1.1.mdns > 224.0.0.251.mdns: 0*- [0q] 18/0/6 (Cache flush) PTR AirPort-Extreme.local., (Cache flush) TXT "", PTR _sleep-proxy._udp.local., PTR 30-35-10-70.1 AirPort Extreme._sleep-proxy._udp.local., SRV airport-extreme.local.:13568 0 0, (Cache flush) PTR AirPort-Extreme.local., (Cache flush) TXT "cu=4dde65b7-ee90-555f-a5a9-f20ee14e9322" "nm=AirPort Extreme" "mac=B8:C7:5D:CD:FC:07" "ssid=hwf.io" "bssinfo=AQIGUYYAAAAGKM/asvcLlX6WCAAAByjP2rL3DA", PTR _acp-sync._tcp.local., PTR VjUFSr1HXFe6xSdkEhH+rA@7OJwS232XUKrbbzgdlqz3A._acp-sync._tcp.local., (Cache flush) TXT "waMA=B8-C7-5D-CD-FC-07,raMA=28-CF-DA-B2-F7-0B,raM2=28-CF-DA-B2-F7-0C,raNm=hwf.io,raCh=6,rCh2=149,raSt=0,raNA=1,syFl=0x820C,syAP=117,syVs=7.6.8,srcv=76800.1,bjSd=29", PTR _airport._tcp.local., PTR AirPort Extreme._airport._tcp.local., TXT "model=AirPort5,117", (Cache flush) SRV AirPort-Extreme.local.:60787 0 0, (Cache flush) A 10.0.1.1, (Cache flush) AAAA fe80::bac7:5dff:fecd:fc07, (Cache flush) SRV AirPort-Extreme.local.:5009 0 0, (Cache flush) SRV AirPort-Extreme.local.:5009 0 0 (1054)
18:11:30.160061 IP6 airport-extreme.local.mdns > ff02::fb.mdns: 0*- [0q] 18/0/6 (Cache flush) PTR AirPort-Extreme.local., (Cache flush) TXT "", PTR _sleep-proxy._udp.local., PTR 30-35-10-70.1 AirPort Extreme._sleep-proxy._udp.local., SRV airport-extreme.local.:13568 0 0, (Cache flush) PTR AirPort-Extreme.local., (Cache flush) TXT "cu=4dde65b7-ee90-555f-a5a9-f20ee14e9322" "nm=AirPort Extreme" "mac=B8:C7:5D:CD:FC:07" "ssid=hwf.io" "bssinfo=AQIGUYYAAAAGKM/asvcLlX6WCAAAByjP2rL3DA", PTR _acp-sync._tcp.local., PTR VjUFSr1HXFe6xSdkEhH+rA@7OJwS232